{
  "schema_version": 2,
  "video": {
    "url": "https://github.com/obra/superpowers",
    "checked_at": "2026-08-18",
    "note": "Curated from obra/superpowers after validating current upstream paths and recent popularity/discovery signals."
  },
  "official_references": [
    {
      "name": "obra/superpowers repository",
      "url": "https://github.com/obra/superpowers",
      "purpose": "Canonical upstream repository for the imported review workflow skills."
    },
    {
      "name": "skills.sh requesting-code-review",
      "url": "https://skills.sh/obra/superpowers/requesting-code-review",
      "purpose": "Confirms the skill is currently discoverable in the public registry."
    },
    {
      "name": "skills.sh receiving-code-review",
      "url": "https://skills.sh/obra/superpowers/receiving-code-review",
      "purpose": "Confirms the skill is currently discoverable in the public registry."
    },
    {
      "name": "skills.sh verification-before-completion",
      "url": "https://skills.sh/obra/superpowers/verification-before-completion",
      "purpose": "Confirms the skill is currently discoverable in the public registry."
    },
    {
      "name": "skills.sh using-superpowers",
      "url": "https://skills.sh/obra/superpowers/using-superpowers",
      "purpose": "Confirms the skill is currently discoverable in the public registry."
    },
    {
      "name": "skills.sh using-git-worktrees",
      "url": "https://skills.sh/obra/superpowers/using-git-worktrees",
      "purpose": "Confirms the skill is currently discoverable in the public registry."
    }
  ],
  "skills": [
    {
      "video_name": "dispatching-parallel-agents",
      "normalized_slug": "dispatching-parallel-agents",
      "status": "verified_in_repo",
      "repo_skill": "skills/ai-workflow/dispatching-parallel-agents/SKILL.md",
      "source": "https://github.com/obra/superpowers/blob/main/skills/dispatching-parallel-agents/SKILL.md",
      "notes": "Imported to complete the superpowers execution workflow for independent parallel subtasks.",
      "upstream": {
        "repo": "obra/superpowers",
        "path": "skills/dispatching-parallel-agents/SKILL.md",
        "ref": "main",
        "last_checked_at": "2026-08-18",
        "last_synced_at": "2026-08-18",
        "last_synced_commit": "9ccce3bf07a40e45259004a330409ba00970eff7",
        "sync_mode": "monitor"
      },
      "kind": "mirror",
      "sync_mode": "monitor",
      "origins": [
        {
          "repo": "obra/superpowers",
          "path": "skills/dispatching-parallel-agents/SKILL.md",
          "license": "MIT",
          "sync_mode": "monitor",
          "artifacts": [
            {
              "source": "skills/dispatching-parallel-agents/SKILL.md",
              "target": "skills/ai-workflow/dispatching-parallel-agents/SKILL.md"
            }
          ],
          "tracking": {
            "channel": "default_branch",
            "ref": "main",
            "resolved_commit": "9ccce3bf07a40e45259004a330409ba00970eff7",
            "path_commit": "9ccce3bf07a40e45259004a330409ba00970eff7",
            "content_sha256": "ba747816da03a5359702ae2ea8973446ca97ef24d6b2ba8b1a362953309cf64c",
            "last_checked_at": "2026-08-18",
            "last_synced_at": "2026-08-18"
          }
        }
      ],
      "managed_files": [
        {
          "path": "skills/ai-workflow/dispatching-parallel-agents/SKILL.md",
          "owner": "dispatching-parallel-agents",
          "sha256": "ba747816da03a5359702ae2ea8973446ca97ef24d6b2ba8b1a362953309cf64c"
        }
      ]
    },
    {
      "video_name": "executing-plans",
      "normalized_slug": "executing-plans",
      "status": "verified_in_repo",
      "repo_skill": "skills/ai-workflow/executing-plans/SKILL.md",
      "source": "https://github.com/obra/superpowers/blob/main/skills/executing-plans/SKILL.md",
      "notes": "Imported to pair design docs and implementation plans with a disciplined execution workflow.",
      "upstream": {
        "repo": "obra/superpowers",
        "path": "skills/executing-plans/SKILL.md",
        "ref": "main",
        "last_checked_at": "2026-08-18",
        "last_synced_at": "2026-08-18",
        "last_synced_commit": "3bdd66eaa5d74faee2d11c933b7a4bbe604c222e",
        "sync_mode": "monitor"
      },
      "kind": "mirror",
      "sync_mode": "monitor",
      "origins": [
        {
          "repo": "obra/superpowers",
          "path": "skills/executing-plans/SKILL.md",
          "license": "MIT",
          "sync_mode": "monitor",
          "artifacts": [
            {
              "source": "skills/executing-plans/SKILL.md",
              "target": "skills/ai-workflow/executing-plans/SKILL.md"
            }
          ],
          "tracking": {
            "channel": "default_branch",
            "ref": "main",
            "resolved_commit": "3bdd66eaa5d74faee2d11c933b7a4bbe604c222e",
            "path_commit": "3bdd66eaa5d74faee2d11c933b7a4bbe604c222e",
            "content_sha256": "d6d75cbfe7f1b1c750681fd38947f51ba32fa313e65cc2c6b142d898c0f5e3f4",
            "last_checked_at": "2026-08-18",
            "last_synced_at": "2026-08-18"
          }
        }
      ],
      "managed_files": [
        {
          "path": "skills/ai-workflow/executing-plans/SKILL.md",
          "owner": "executing-plans",
          "sha256": "d6d75cbfe7f1b1c750681fd38947f51ba32fa313e65cc2c6b142d898c0f5e3f4"
        }
      ]
    },
    {
      "video_name": "finishing-a-development-branch",
      "normalized_slug": "finishing-a-development-branch",
      "status": "verified_in_repo",
      "repo_skill": "skills/ai-workflow/finishing-a-development-branch/SKILL.md",
      "source": "https://github.com/obra/superpowers/blob/main/skills/finishing-a-development-branch/SKILL.md",
      "notes": "Imported to formalize the endgame for feature branches after implementation and verification.",
      "upstream": {
        "repo": "obra/superpowers",
        "path": "skills/finishing-a-development-branch/SKILL.md",
        "ref": "main",
        "last_checked_at": "2026-08-18",
        "last_synced_at": "2026-08-18",
        "last_synced_commit": "141953a4bedbb539551c5eebcfe2024771876bb7",
        "sync_mode": "monitor"
      },
      "kind": "mirror",
      "sync_mode": "monitor",
      "origins": [
        {
          "repo": "obra/superpowers",
          "path": "skills/finishing-a-development-branch/SKILL.md",
          "license": "MIT",
          "sync_mode": "monitor",
          "artifacts": [
            {
              "source": "skills/finishing-a-development-branch/SKILL.md",
              "target": "skills/ai-workflow/finishing-a-development-branch/SKILL.md"
            }
          ],
          "tracking": {
            "channel": "default_branch",
            "ref": "main",
            "resolved_commit": "141953a4bedbb539551c5eebcfe2024771876bb7",
            "path_commit": "141953a4bedbb539551c5eebcfe2024771876bb7",
            "content_sha256": "535c9ada1f4dfcf344c60a81727178b2438061e1c7ccdca8f8fb5566612f6473",
            "last_checked_at": "2026-08-18",
            "last_synced_at": "2026-08-18"
          }
        }
      ],
      "managed_files": [
        {
          "path": "skills/ai-workflow/finishing-a-development-branch/SKILL.md",
          "owner": "finishing-a-development-branch",
          "sha256": "535c9ada1f4dfcf344c60a81727178b2438061e1c7ccdca8f8fb5566612f6473"
        }
      ]
    },
    {
      "video_name": "receiving-code-review",
      "normalized_slug": "receiving-code-review",
      "status": "verified_in_repo",
      "repo_skill": "skills/ai-workflow/receiving-code-review/SKILL.md",
      "source": "https://skills.sh/obra/superpowers/receiving-code-review",
      "notes": "Imported to help teams evaluate review comments rigorously instead of applying them blindly.",
      "upstream": {
        "repo": "obra/superpowers",
        "path": "skills/receiving-code-review/SKILL.md",
        "ref": "main",
        "last_checked_at": "2026-08-18",
        "last_synced_at": "2026-08-18",
        "last_synced_commit": "1455ac0631e2f3824229f6a31a1877dc6b96952f",
        "sync_mode": "monitor"
      },
      "kind": "mirror",
      "sync_mode": "monitor",
      "origins": [
        {
          "repo": "obra/superpowers",
          "path": "skills/receiving-code-review/SKILL.md",
          "license": "MIT",
          "sync_mode": "monitor",
          "artifacts": [
            {
              "source": "skills/receiving-code-review/SKILL.md",
              "target": "skills/ai-workflow/receiving-code-review/SKILL.md"
            }
          ],
          "tracking": {
            "channel": "default_branch",
            "ref": "main",
            "resolved_commit": "1455ac0631e2f3824229f6a31a1877dc6b96952f",
            "path_commit": "1455ac0631e2f3824229f6a31a1877dc6b96952f",
            "content_sha256": "d00f1dfa10f0fd71d87589b18d70b1d74d9272f5fb7728e605d9e424ebf9604d",
            "last_checked_at": "2026-08-18",
            "last_synced_at": "2026-08-18"
          }
        }
      ],
      "managed_files": [
        {
          "path": "skills/ai-workflow/receiving-code-review/SKILL.md",
          "owner": "receiving-code-review",
          "sha256": "d00f1dfa10f0fd71d87589b18d70b1d74d9272f5fb7728e605d9e424ebf9604d"
        }
      ]
    },
    {
      "video_name": "requesting-code-review",
      "normalized_slug": "requesting-code-review",
      "status": "verified_in_repo",
      "repo_skill": "skills/ai-workflow/requesting-code-review/SKILL.md",
      "source": "https://skills.sh/obra/superpowers/requesting-code-review",
      "notes": "Imported to strengthen the repository's review-request workflow coverage before merge or milestone handoff.",
      "upstream": {
        "repo": "obra/superpowers",
        "path": "skills/requesting-code-review/SKILL.md",
        "ref": "main",
        "last_checked_at": "2026-08-18",
        "last_synced_at": "2026-08-18",